PORT1 OFF:
  74    OUT    55 5a 01 01  00 02                                  UZ....                   1.1.0        
  74    IN     55 5a 01 01  00 02                                  UZ....                   2.1.0     
PORT1 ON:  
  74    OUT    55 5a 01 01  01 03                                  UZ....                   3.1.0        
  74    IN     55 5a 01 01  01 03                                  UZ....                   4.1.0        
PORT2 OFF:
  74    OUT    55 5a 01 02  00 03                                  UZ....                   5.1.0        
  74    IN     55 5a 01 02  00 03                                  UZ....                   6.1.0        
PORT2 ON:
  74    OUT    55 5a 01 02  01 04                                  UZ....                   7.1.0        
  74    IN     55 5a 01 02  01 04                                  UZ....                   8.1.0        
PORT3 OFF:
  74    OUT    55 5a 01 04  00 05                                  UZ....                   9.1.0        
  74    IN     55 5a 01 04  00 05                                  UZ....                  10.1.0        
PORT3 ON:  
  74    OUT    55 5a 01 04  01 06                                  UZ....                  11.1.0        
  74    IN     55 5a 01 04  01 06                                  UZ....                  12.1.0        
PORT4 OFF:
  74    OUT    55 5a 01 08  00 09                                  UZ....                  13.1.0        
  74    IN     55 5a 01 08  00 09                                  UZ....                  14.1.0        
PORT4 ON:  
  74    OUT    55 5a 01 08  01 0a                                  UZ....                  15.1.0        
  74    IN     55 5a 01 08  01 0a                                  UZ....                  16.1.0    
Diable Hardware keys:  
  74    OUT    55 5a 09 00  00 09                                  UZ....                  17.1.0        
  74    IN     55 5a 09 00  00 09                                  UZ....                  18.1.0        
  74    OUT    55 5a 0a 00  00 0a                                  UZ....                  19.1.0        
  74    IN     55 5a 0a 00  00 0a                                  UZ....                  20.1.0        
Enable Hardware keys:    
  74    OUT    55 5a 09 00  01 0a                                  UZ....                  21.1.0        
  74    IN     55 5a 09 00  01 0a                                  UZ....                  22.1.0        
  74    OUT    55 5a 0a 00  00 0a                                  UZ....                  23.1.0        
  74    IN     55 5a 0a 00  01 0b                                  UZ....                  24.1.0   
Disable auto Saving:
  74    OUT    55 5a 0f 00  00 0f                                  UZ....                  25.1.0        
  74    IN     55 5a 0f 00  00 0f                                  UZ....                  26.1.0        
  74    OUT    55 5a 10 00  00 10                                  UZ....                  27.1.0        
  74    IN     55 5a 10 00  00 10                                  UZ....                  28.1.0        
Enable auto Saving:
  74    OUT    55 5a 0f 00  01 10                                  UZ....                  29.1.0        
  74    IN     55 5a 0f 00  01 10                                  UZ....                  30.1.0        
  74    OUT    55 5a 10 00  00 10                                  UZ....                  31.1.0        
  74    IN     55 5a 10 00  01 11                                  UZ....                  32.1.0    
Default ON:  
  74    OUT    55 5a 0b 0f  01 01 1c                               UZ.....                 33.1.0        
  74    IN     55 5a 0b 0f  01 01 1c                               UZ.....                 34.1.0      
Lock ON  
  74    OUT    55 5a 06 00  01 07                                  UZ....                  35.1.0        
  74    IN     55 5a 06 00  01 07                                  UZ....                  36.1.0        
  74    OUT    55 5a 07 00  00 07                                  UZ....                  37.1.0        
  74    IN     55 5a 07 00  01 08                                  UZ....                  38.1.0     
Lock off  
  74    OUT    55 5a 06 00  00 06                                  UZ....                  39.1.0        
  74    IN     55 5a 06 00  00 06                                  UZ....                  40.1.0        
  74    OUT    55 5a 07 00  00 07                                  UZ....                  41.1.0        
  74    IN     55 5a 07 00  00 07                                  UZ....                  42.1.0        
query all port status
55 5A 00 0F 00 0F
to query all port status
The HUB return like:
55 5A 00 01 01 02 55 5A 00 02 01 03 55 5A 00 04 01 05 55 5A 00 08 00 08
